{"$schema":"https://json-schema.org/draft/2020-12/schema","type":"object","additionalProperties":false,"required":["service_as_described","service_classification","classification_basis","classification_reviewed","special_place_of_supply_reviewed","automation_level","human_intervention","article59c_assessment","billing_frequency","currency","price_basis","transaction_date","tax_point_date","payment_provider","amount","events"],"properties":{"service_as_described":{"type":"string"},"service_classification":{"enum":["unclassified","GENERAL_SERVICE","ELECTRONICALLY_SUPPLIED_SERVICE","CONSULTANCY","HUMAN_PERFORMED_TECHNICAL_SERVICE","MIXED_OR_COMPOSITE_SERVICE","UNKNOWN","automated_electronic_service","human_performed_maintenance","consultancy","mixed_composite","other"]},"classification_basis":{"type":"array","items":{"type":"string"}},"classification_reviewed":{"type":"boolean"},"special_place_of_supply_reviewed":{"type":"boolean"},"automation_level":{"enum":["none","partial","high","unknown"]},"human_intervention":{"enum":["none","incidental","material","unknown"]},"article59c_assessment":{"enum":["not_assessed","not_applicable","threshold_not_exceeded_no_option","option_exercised","above_threshold","unknown"]},"billing_frequency":{"enum":["one_time","monthly","annual","other","unknown"]},"currency":{"type":"string","pattern":"^[A-Z]{3}$"},"price_basis":{"enum":["gross","net","unknown"]},"transaction_date":{"type":"string","format":"date"},"tax_point_date":{"type":["string","null"],"format":"date"},"payment_provider":{"type":["string","null"]},"amount":{"type":["number","null"],"minimum":0},"events":{"type":"array","items":{"type":"object","required":["type","date"],"properties":{"type":{"enum":["purchase","payment","renewal","discount","refund","partial_refund","status_change","cancellation","credit_note"]},"date":{"type":"string","format":"date"},"amount":{"type":["number","null"]},"details":{"type":"string"}},"additionalProperties":false}},"supplier_establishment_review":{"enum":["no_relevant_fixed_establishment","relevant_fixed_establishment","unresolved","unreviewed"]},"recipient_establishment_review":{"enum":["no_relevant_fixed_establishment","relevant_fixed_establishment","unresolved","unreviewed"]}}}
